"title","body","rating","review_date","reviewer_name","reviewer_email","product_handle","sku","product_name","ean"
"","Quick delivery, works fine","5","27/02/2026","K","reviewer1@example.com","predator-cestus-333-gaming-mouse","GP.MCE11.03S","Predator Cestus 333 Gaming Mouse","4711121334706"
"Good value","shape is comfortable and cable feels light. good for the price","5","24/03/2026","Bruno K.","reviewer2@example.com","predator-cestus-333-gaming-mouse","GP.MCE11.03S","Predator Cestus 333 Gaming Mouse","4711121334706"
"Solid choice","clicks feel crisp and the dpi switch is handy","5","01/03/2026","Clara D.","reviewer3@example.com","predator-cestus-333-gaming-mouse","GP.MCE11.03S","Predator Cestus 333 Gaming Mouse","4711121334706"
"Nice upgrade","honestly, sensor is accurate and glide is smooth","5","25/02/2026","Daniel P.","reviewer4@example.com","predator-cestus-333-gaming-mouse","GP.MCE11.03S","Predator Cestus 333 Gaming Mouse","4711121334706"
"Very happy","cable feels light and i like it a lot","5","25/03/2026","Elena R.","reviewer5@example.com","predator-cestus-333-gaming-mouse","GP.MCE11.03S","Predator Cestus 333 Gaming Mouse","4711121334706"
"Pretty good","after a few days, dpi switch is handy and feels responsive.","5","24/03/2026","Felix N.","reviewer6@example.com","predator-cestus-333-gaming-mouse","GP.MCE11.03S","Predator Cestus 333 Gaming Mouse","4711121334706"
"","first impression: glide is smooth and side buttons are easy to reach","4","09/03/2026","Giulia S.","reviewer7@example.com","predator-cestus-333-gaming-mouse","GP.MCE11.03S","Predator Cestus 333 Gaming Mouse","4711121334706"
"","been using it daily and rgb looks clean, tracking feels precise","5","05/02/2026","Hugo T.","reviewer8@example.com","predator-cestus-333-gaming-mouse","GP.MCE11.03S","Predator Cestus 333 Gaming Mouse","4711121334706"
"","works great","4","08/03/2026","Isabel F.","reviewer9@example.com","predator-cestus-333-gaming-mouse","GP.MCE11.03S","Predator Cestus 333 Gaming Mouse","4711121334706"
"","surprisingly good.","4","18/02/2026","K","reviewer21@example.com","predator-galea-330","GP.HDS11.01P","Predator Galea 330","4711121326158"
"Good value","happy with it because bluetooth pairing was quick and they feel light in the ear","5","23/02/2026","Bruno K.","reviewer22@example.com","predator-galea-330","GP.HDS11.01P","Predator Galea 330","4711121326158"
"Solid choice","for the price, latency stays low enough for casual play and calls come through clearly","5","13/02/2026","Clara D.","reviewer23@example.com","predator-galea-330","GP.HDS11.01P","Predator Galea 330","4711121326158"
"Nice upgrade","no issues really, the case is easy to carry and battery is decent","5","01/02/2026","Daniel P.","reviewer24@example.com","predator-galea-330","GP.HDS11.01P","Predator Galea 330","4711121326158"
"Very happy","they feel light in the ear and i like them a lot","5","05/02/2026","Elena R.","reviewer25@example.com","predator-galea-330","GP.HDS11.01P","Predator Galea 330","4711121326158"
"Pretty good","calls come through clearly and the fit is comfortable","5","28/03/2026","Felix N.","reviewer26@example.com","predator-galea-330","GP.HDS11.01P","Predator Galea 330","4711121326158"
"","battery is decent and the rgb detail is fun","5","02/02/2026","Giulia S.","reviewer27@example.com","predator-galea-330","GP.HDS11.01P","Predator Galea 330","4711121326158"
"","used it a bit now and touch controls work fine and sound is clear for games and calls","5","30/03/2026","Hugo T.","reviewer28@example.com","predator-galea-330","GP.HDS11.01P","Predator Galea 330","4711121326158"
"","works great :) ","4","08/03/2026","Isabel F.","reviewer29@example.com","predator-galea-330","GP.HDS11.01P","Predator Galea 330","4711121326158"
"","better than expected, the rgb detail is fun and latency stays low enough for casual play","5","04/04/2026","Zed","reviewer30@example.com","predator-galea-330","GP.HDS11.01P","Predator Galea 330","4711121326158"
"Works well","simple but solid, sound is clear for games and calls and the case is easy to carry","5","24/03/2026","K","reviewer31@example.com","predator-galea-330","GP.HDS11.01P","Predator Galea 330","4711121326158"
"K","up to now, bluetooth pairing was quick and they feel light in the ear","4","07/02/2026","Luca B.","reviewer32@example.com","predator-galea-330","GP.HDS11.01P","Predator Galea 330","4711121326158"
"","great bag.","5","06/04/2026","K","reviewer41@example.com","predator-utility-urban-backpack-16","GP.BAG11.07U","Predator Utility Urban backpack 16""","4711121233087"
"Good value","Quick delivery and the compartments are useful, the look is clean","5","01/04/2026","Bruno K.","reviewer42@example.com","predator-utility-urban-backpack-16","GP.BAG11.07U","Predator Utility Urban backpack 16""","4711121233087"
"Solid choice","honestly, it protects a laptop well and zips feel solid","5","24/03/2026","Clara D.","reviewer43@example.com","predator-utility-urban-backpack-16","GP.BAG11.07U","Predator Utility Urban backpack 16""","4711121233087"
"Nice upgrade","after a few days, straps are comfortable and it holds daily gear well","4","05/04/2026","Daniel P.","reviewer44@example.com","predator-utility-urban-backpack-16","GP.BAG11.07U","Predator Utility Urban backpack 16""","4711121233087"
"Very happy","the look is clean and i like it","5","16/02/2026","Elena R.","reviewer45@example.com","predator-utility-urban-backpack-16","GP.BAG11.07U","Predator Utility Urban backpack 16""","4711121233087"
"Pretty good","first impression: zips feel solid and it travels well","4","30/03/2026","Felix N.","reviewer46@example.com","predator-utility-urban-backpack-16","GP.BAG11.07U","Predator Utility Urban backpack 16""","4711121233087"
"","been using it daily and it holds daily gear well, easy to organise too","5","21/02/2026","Giulia S.","reviewer47@example.com","predator-utility-urban-backpack-16","GP.BAG11.07U","Predator Utility Urban backpack 16""","4711121233087"
"","happy with it because the laptop sleeve feels padded and it feels sturdy","5","05/02/2026","Hugo T.","reviewer48@example.com","predator-utility-urban-backpack-16","GP.BAG11.07U","Predator Utility Urban backpack 16""","4711121233087"
"","great bag","4","08/03/2026","Isabel F.","reviewer49@example.com","predator-utility-urban-backpack-16","GP.BAG11.07U","Predator Utility Urban backpack 16""","4711121233087"
"","for the price, it is easy to organise and it protects a laptop well","5","19/02/2026","Zed","reviewer50@example.com","predator-utility-urban-backpack-16","GP.BAG11.07U","Predator Utility Urban backpack 16""","4711121233087"
"Works well","no issues really, it feels sturdy and straps are comfortable","5","12/02/2026","K","reviewer51@example.com","predator-utility-urban-backpack-16","GP.BAG11.07U","Predator Utility Urban backpack 16""","4711121233087"
"K","the compartments are useful and the look is clean","5","24/03/2026","Luca B.","reviewer52@example.com","predator-utility-urban-backpack-16","GP.BAG11.07U","Predator Utility Urban backpack 16""","4711121233087"
"","protects a laptop well and feels reliable","4","07/03/2026","Marta C.","reviewer53@example.com","predator-utility-urban-backpack-16","GP.BAG11.07U","Predator Utility Urban backpack 16""","4711121233087"
"Phil","best for daily carry, good otherwise because straps are comfortable","4","28/03/2026","Niels V.","reviewer54@example.com","predator-utility-urban-backpack-16","GP.BAG11.07U","Predator Utility Urban backpack 16""","4711121233087"
"Very happy","not perfect because it is practical more than premium, still the look is clean","4","16/02/2026","Phil","reviewer55@example.com","predator-utility-urban-backpack-16","GP.BAG11.07U","Predator Utility Urban backpack 16""","4711121233087"
"","good controller.","4","11/02/2026","K","reviewer61@example.com","acer-nitro-gaming-controller-for-smartphones","GP.OTH11.074","Acer Nitro Gaming Controller for Smartphones","4711121342147"
"Good value","input feels responsive and it folds away neatly","5","22/03/2026","Bruno K.","reviewer62@example.com","acer-nitro-gaming-controller-for-smartphones","GP.OTH11.074","Acer Nitro Gaming Controller for Smartphones","4711121342147"
"Solid choice","used it a bit now and usb-c connection is stable and sticks feel better than expected","5","24/02/2026","Clara D.","reviewer63@example.com","acer-nitro-gaming-controller-for-smartphones","GP.OTH11.074","Acer Nitro Gaming Controller for Smartphones","4711121342147"
"Nice upgrade","better than expected, pass-through charging is useful and mobile games feel easier to control","5","19/02/2026","Daniel P.","reviewer64@example.com","acer-nitro-gaming-controller-for-smartphones","GP.OTH11.074","Acer Nitro Gaming Controller for Smartphones","4711121342147"
"Very happy","folds away neatly and feels handy","5","09/02/2026","Elena R.","reviewer65@example.com","acer-nitro-gaming-controller-for-smartphones","GP.OTH11.074","Acer Nitro Gaming Controller for Smartphones","4711121342147"
"Pretty good","simple but solid, sticks feel better than expected and setup was straightforward","5","19/03/2026","Felix N.","reviewer66@example.com","acer-nitro-gaming-controller-for-smartphones","GP.OTH11.074","Acer Nitro Gaming Controller for Smartphones","4711121342147"
"","up to now, mobile games feel easier to control and build feels solid","4","08/03/2026","Giulia S.","reviewer67@example.com","acer-nitro-gaming-controller-for-smartphones","GP.OTH11.074","Acer Nitro Gaming Controller for Smartphones","4711121342147"
"","works with larger phones and phone fit is secure","5","28/03/2026","Hugo T.","reviewer68@example.com","acer-nitro-gaming-controller-for-smartphones","GP.OTH11.074","Acer Nitro Gaming Controller for Smartphones","4711121342147"
"","much better.","5","21/02/2026","K","reviewer81@example.com","acer-vertical-mouse-smart-fit","HP.EXPBG.020","Acer Vertical Mouse Smart Fit","4711121004120"
"Good value","honestly, plug and play setup was easy and clicks are consistent","5","19/03/2026","Bruno K.","reviewer82@example.com","acer-vertical-mouse-smart-fit","HP.EXPBG.020","Acer Vertical Mouse Smart Fit","4711121004120"
"Solid choice","after a few days, tracking is smooth for office work and it is nice for long desk sessions","5","01/02/2026","Clara D.","reviewer83@example.com","acer-vertical-mouse-smart-fit","HP.EXPBG.020","Acer Vertical Mouse Smart Fit","4711121004120"
"Nice upgrade","first impression: the shape feels natural and the angle helps reduce strain","5","03/04/2026","Daniel P.","reviewer84@example.com","acer-vertical-mouse-smart-fit","HP.EXPBG.020","Acer Vertical Mouse Smart Fit","4711121004120"
"Very happy","clicks are consistent and it feels solid","5","12/02/2026","Elena R.","reviewer85@example.com","acer-vertical-mouse-smart-fit","HP.EXPBG.020","Acer Vertical Mouse Smart Fit","4711121004120"
"Pretty good","been using it daily and it is nice for long desk sessions, value is good too","5","01/04/2026","Felix N.","reviewer86@example.com","acer-vertical-mouse-smart-fit","HP.EXPBG.020","Acer Vertical Mouse Smart Fit","4711121004120"
"","happy with it because the angle helps reduce strain and it is easy to use all day","5","14/02/2026","Giulia S.","reviewer87@example.com","acer-vertical-mouse-smart-fit","HP.EXPBG.020","Acer Vertical Mouse Smart Fit","4711121004120"
"","for the price, it feels light but usable and wrist comfort is noticeably better","5","26/03/2026","Hugo T.","reviewer88@example.com","acer-vertical-mouse-smart-fit","HP.EXPBG.020","Acer Vertical Mouse Smart Fit","4711121004120"
"","better than expected","5","14/03/2026","Isabel F.","reviewer89@example.com","acer-vertical-mouse-smart-fit","HP.EXPBG.020","Acer Vertical Mouse Smart Fit","4711121004120"
"","no issues really, it is easy to use all day and tracking is smooth for office work","5","13/02/2026","Zed","reviewer90@example.com","acer-vertical-mouse-smart-fit","HP.EXPBG.020","Acer Vertical Mouse Smart Fit","4711121004120"
"Works well","wrist comfort is noticeably better and the shape feels natural","5","14/02/2026","K","reviewer91@example.com","acer-vertical-mouse-smart-fit","HP.EXPBG.020","Acer Vertical Mouse Smart Fit","4711121004120"
"K","plug and play setup was easy and clicks are consistent","5","28/02/2026","Luca B.","reviewer92@example.com","acer-vertical-mouse-smart-fit","HP.EXPBG.020","Acer Vertical Mouse Smart Fit","4711121004120"
"","tracking is smooth for office work and feels comfortable","4","29/03/2026","Marta C.","reviewer93@example.com","acer-vertical-mouse-smart-fit","HP.EXPBG.020","Acer Vertical Mouse Smart Fit","4711121004120"
"Phil","the shape feels natural, but small hands may need time to adjust","4","14/03/2026","Niels V.","reviewer94@example.com","acer-vertical-mouse-smart-fit","HP.EXPBG.020","Acer Vertical Mouse Smart Fit","4711121004120"
"Very happy","delivery had a delay but seller was responsive, clicks are consistent overall good pick","4","27/02/2026","Phil","reviewer95@example.com","acer-vertical-mouse-smart-fit","HP.EXPBG.020","Acer Vertical Mouse Smart Fit","4711121004120"
"Pretty good","main downside is it is not silent, otherwise it is nice for long desk sessions","4","09/03/2026","Pavel J.","reviewer96@example.com","acer-vertical-mouse-smart-fit","HP.EXPBG.020","Acer Vertical Mouse Smart Fit","4711121004120"
"","much better","4","31/03/2026","Quentin R.","reviewer97@example.com","acer-vertical-mouse-smart-fit","HP.EXPBG.020","Acer Vertical Mouse Smart Fit","4711121004120"
"","nice backpack.","5","16/02/2026","K","reviewer101@example.com","acer-urban-backpack-grey-green","GP.BAG11.034","Acer Urban Backpack Grey / Green","4711121235128"
"Good value","used it a bit now and it is easy to carry every day and weight stays low","5","01/02/2026","Bruno K.","reviewer102@example.com","acer-urban-backpack-grey-green","GP.BAG11.034","Acer Urban Backpack Grey / Green","4711121235128"
"Solid choice","better than expected, it fits a 15.6 inch laptop well and looks simple and practical","5","06/04/2026","Clara D.","reviewer103@example.com","acer-urban-backpack-grey-green","GP.BAG11.034","Acer Urban Backpack Grey / Green","4711121235128"
"Nice upgrade","simple but solid, the layout works for commuting and the fabric feels decent","5","06/04/2026","Daniel P.","reviewer104@example.com","acer-urban-backpack-grey-green","GP.BAG11.034","Acer Urban Backpack Grey / Green","4711121235128"
"Very happy","weight stays low which i appreciate","5","12/02/2026","Elena R.","reviewer105@example.com","acer-urban-backpack-grey-green","GP.BAG11.034","Acer Urban Backpack Grey / Green","4711121235128"
"Pretty good","up to now, it looks simple and practical and daily essentials fit well.","5","27/02/2026","Felix N.","reviewer106@example.com","acer-urban-backpack-grey-green","GP.BAG11.034","Acer Urban Backpack Grey / Green","4711121235128"
"","the fabric feels decent and it works well for city use","5","04/03/2026","Giulia S.","reviewer107@example.com","acer-urban-backpack-grey-green","GP.BAG11.034","Acer Urban Backpack Grey / Green","4711121235128"
"","honestly, it is easy to grab and go and the colorway looks nice","5","14/02/2026","Hugo T.","reviewer108@example.com","acer-urban-backpack-grey-green","GP.BAG11.034","Acer Urban Backpack Grey / Green","4711121235128"
"","ALl good","4","12/03/2026","Isabel F.","reviewer109@example.com","acer-urban-backpack-grey-green","GP.BAG11.034","Acer Urban Backpack Grey / Green","4711121235128"
"","after a few days, it works well for city use and it fits a 15.6 inch laptop well..","4","28/03/2026","Zed","reviewer110@example.com","acer-urban-backpack-grey-green","GP.BAG11.034","Acer Urban Backpack Grey / Green","4711121235128"
"Works well","first impression: the colorway looks nice and the layout works for commuting","4","09/02/2026","K","reviewer111@example.com","acer-urban-backpack-grey-green","GP.BAG11.034","Acer Urban Backpack Grey / Green","4711121235128"
"","very useful.","5","12/02/2026","K","reviewer121@example.com","acer-wi-fi-5g-mobile-hotspot-acer-connect-m6e","FF.G2VTA.001","Acer Wi-Fi 5G Mobile Hotspot | Acer Connect M6E","4711121809029"
"Good value","been using it daily and battery life is good for trips, handles multiple devices well","5","17/03/2026","Bruno K.","reviewer122@example.com","acer-wi-fi-5g-mobile-hotspot-acer-connect-m6e","FF.G2VTA.001","Acer Wi-Fi 5G Mobile Hotspot | Acer Connect M6E","4711121809029"
"Solid choice","happy with it because the touchscreen makes setup easy and speed is better than expected","5","15/03/2026","Clara D.","reviewer123@example.com","acer-wi-fi-5g-mobile-hotspot-acer-connect-m6e","FF.G2VTA.001","Acer Wi-Fi 5G Mobile Hotspot | Acer Connect M6E","4711121809029"
"Nice upgrade","for the price, it is useful abroad and easy to carry","5","26/02/2026","Daniel P.","reviewer124@example.com","acer-wi-fi-5g-mobile-hotspot-acer-connect-m6e","FF.G2VTA.001","Acer Wi-Fi 5G Mobile Hotspot | Acer Connect M6E","4711121809029"
"Very happy","handles multiple devices well and has been useful","5","01/03/2026","Elena R.","reviewer125@example.com","acer-wi-fi-5g-mobile-hotspot-acer-connect-m6e","FF.G2VTA.001","Acer Wi-Fi 5G Mobile Hotspot | Acer Connect M6E","4711121809029"
"Pretty good","no issues really, speed is better than expected and it has been reliable on the move","5","04/02/2026","Felix N.","reviewer126@example.com","acer-wi-fi-5g-mobile-hotspot-acer-connect-m6e","FF.G2VTA.001","Acer Wi-Fi 5G Mobile Hotspot | Acer Connect M6E","4711121809029"
"","easy to carry and it saves tethering hassle","5","03/03/2026","Giulia S.","reviewer127@example.com","acer-wi-fi-5g-mobile-hotspot-acer-connect-m6e","FF.G2VTA.001","Acer Wi-Fi 5G Mobile Hotspot | Acer Connect M6E","4711121809029"
"","usb-c charging is convenient and the connection has been fast and stable","5","17/02/2026","Hugo T.","reviewer128@example.com","acer-wi-fi-5g-mobile-hotspot-acer-connect-m6e","FF.G2VTA.001","Acer Wi-Fi 5G Mobile Hotspot | Acer Connect M6E","4711121809029"
"","very useful","5","15/02/2026","Isabel F.","reviewer129@example.com","acer-wi-fi-5g-mobile-hotspot-acer-connect-m6e","FF.G2VTA.001","Acer Wi-Fi 5G Mobile Hotspot | Acer Connect M6E","4711121809029"
"","used it a bit now and it saves tethering hassle and the touchscreen makes setup easy..","5","03/04/2026","Zed","reviewer130@example.com","acer-wi-fi-5g-mobile-hotspot-acer-connect-m6e","FF.G2VTA.001","Acer Wi-Fi 5G Mobile Hotspot | Acer Connect M6E","4711121809029"
"Works well","better than expected, connection has been fast and stable and it is useful abroad","4","10/02/2026","K","reviewer131@example.com","acer-wi-fi-5g-mobile-hotspot-acer-connect-m6e","FF.G2VTA.001","Acer Wi-Fi 5G Mobile Hotspot | Acer Connect M6E","4711121809029"
"K","simple but solid, battery life is good for trips and it handles multiple devices well","5","10/02/2026","Luca B.","reviewer132@example.com","acer-wi-fi-5g-mobile-hotspot-acer-connect-m6e","FF.G2VTA.001","Acer Wi-Fi 5G Mobile Hotspot | Acer Connect M6E","4711121809029"
"","the touchscreen makes setup easy and feels intuitive","4","22/02/2026","Marta C.","reviewer133@example.com","acer-wi-fi-5g-mobile-hotspot-acer-connect-m6e","FF.G2VTA.001","Acer Wi-Fi 5G Mobile Hotspot | Acer Connect M6E","4711121809029"
"Phil","delivery had a delay but seller was responsive, still useful abroad","4","03/03/2026","Niels V.","reviewer134@example.com","acer-wi-fi-5g-mobile-hotspot-acer-connect-m6e","FF.G2VTA.001","Acer Wi-Fi 5G Mobile Hotspot | Acer Connect M6E","4711121809029"
"","works fine","5","07/03/2026","K","reviewer141@example.com","13-in-1-docking-stand","HP.DSCAB.015","13-in-1 docking stand","4711121815000"
"Good value","desk cable clutter is much lower now and display outputs have been reliable","5","11/03/2026","Bruno K.","reviewer142@example.com","13-in-1-docking-stand","HP.DSCAB.015","13-in-1 docking stand","4711121815000"
"Solid choice","up to now, charging through usb-c works well and it is handy as both dock and stand","4","22/02/2026","Clara D.","reviewer143@example.com","13-in-1-docking-stand","HP.DSCAB.015","13-in-1 docking stand","4711121815000"
"Nice upgrade","makes a laptop desk setup cleaner and setup was simple","5","01/03/2026","Daniel P.","reviewer144@example.com","13-in-1-docking-stand","HP.DSCAB.015","13-in-1 docking stand","4711121815000"
"Very happy","display outputs have been reliable and stable","5","24/02/2026","Elena R.","reviewer145@example.com","13-in-1-docking-stand","HP.DSCAB.015","13-in-1 docking stand","4711121815000"
"Pretty good","honestly, it is handy as both dock and stand and the extra usb ports are great","5","06/03/2026","Felix N.","reviewer146@example.com","13-in-1-docking-stand","HP.DSCAB.015","13-in-1 docking stand","4711121815000"
"","after a few days, setup was simple and it feels practical from day one","4","24/02/2026","Giulia S.","reviewer147@example.com","13-in-1-docking-stand","HP.DSCAB.015","13-in-1 docking stand","4711121815000"
